bank_name|bank_link|city|state|pr_id|pr_link|closing_date|assets|deposit|acquirer_notes
Palos Bank and Trust Company, Palos Heights, IL|https://www.fdic.gov/resources/resolutions/bank-failures/failed-bank-list/palosbank.html|||PR-189-2010|https://www.fdic.gov/news/press-releases/2010/pr10189.html|August 13, 2010|$493.4|$467.8|First Midwest Bank, Itasca, IL has agreed to assume all deposits.
Ravenswood Bank, Chicago, IL|https://www.fdic.gov/resources/resolutions/bank-failures/failed-bank-list/ravenswood.html|||PR-181-2010|https://www.fdic.gov/news/press-releases/2010/pr10181.html|August 6, 2010|$264.6|$269.5|Northbrook Bank and Trust Company, Northbrook, IL has agreed to assume all deposits, excluding certain brokered deposits.
LibertyBank, Eugene, OR|https://www.fdic.gov/resources/resolutions/bank-failures/failed-bank-list/libertyor.html|||PR-176-2010|https://www.fdic.gov/news/press-releases/2010/pr10176.html|July 30, 2010|$768.2|$718.5|Home Federal Bank, Nampa, ID has agreed to assume all deposits.
The Cowlitz Bank, Longview, WA|https://www.fdic.gov/resources/resolutions/bank-failures/failed-bank-list/cowlitz.html|||PR-175-2010|https://www.fdic.gov/news/press-releases/2010/pr10175.html|July 30, 2010|$529.3|$513.9|Heritage Bank, Olympia, WA has agreed to assume all deposits, excluding certain brokered deposits.
Coastal Community Bank, Panama City Beach, FL|https://www.fdic.gov/resources/resolutions/bank-failures/failed-bank-list/coastal.html|||PR-174-2010|https://www.fdic.gov/news/press-releases/2010/pr10174.html|July 30, 2010|$372.9|$363.2|Centennial Bank, Conway, AR has agreed to assume all deposits.
Bayside Savings Bank, Port Saint Joe, FL|https://www.fdic.gov/resources/resolutions/bank-failures/failed-bank-list/bayside.html|||PR-174-2010|https://www.fdic.gov/news/press-releases/2010/pr10174.html|July 30, 2010|$66.1|$52.4|Centennial Bank, Conway, AR has agreed to assume all deposits.
NorthWest Bank and Trust, Acworth, GA|https://www.fdic.gov/resources/resolutions/bank-failures/failed-bank-list/northwestga.html|||PR-172-2010|https://www.fdic.gov/news/press-releases/2010/pr10172.html|July 30, 2010|$167.7|$159.4|State Bank and Trust Company, Macon Georgia, has agreed to assume all deposits, excluding certain brokered deposits.
Home Valley Bank, Cave Junction, OR|https://www.fdic.gov/resources/resolutions/bank-failures/failed-bank-list/homevalleyor.html|||PR-169-2010|https://www.fdic.gov/news/press-releases/2010/pr10169.html|July 23, 2010|$251.8|$229.6|South Valley Bank & Trust, Klamath Falls, OR has agreed to assume all deposits.
SouthwestUSA Bank, Las Vegas, NV|https://www.fdic.gov/resources/resolutions/bank-failures/failed-bank-list/southwestusanv.html|||PR-168-2010|https://www.fdic.gov/news/press-releases/2010/pr10168.html|July 23, 2010|$214.0|$186.7|Plaza Bank, Irvine, CA has agreed to assume all deposits, excluding certain brokered deposits.
Community Security Bank, New Prague, MN|https://www.fdic.gov/resources/resolutions/bank-failures/failed-bank-list/communitysecmn.html|||PR-167-2010|https://www.fdic.gov/news/press-releases/2010/pr10167.html|July 23, 2010|$108.0|$99.7|Roundbank, Waseca, MN has agreed to assume all deposits.
Thunder Bank, Sylvan Grove, KS|https://www.fdic.gov/resources/resolutions/bank-failures/failed-bank-list/thunderbankks.html|||PR-166-2010|https://www.fdic.gov/news/press-releases/2010/pr10166.html|July 23, 2010|$32.6|$28.5|The Bennington State Bank, Salina, KS has agreed to assume all deposits, excluding certain brokered deposits.
Williamsburg First National Bank, Kingstree, SC|https://www.fdic.gov/resources/resolutions/bank-failures/failed-bank-list/williamsburgsc.html|||PR-165-2010|https://www.fdic.gov/news/press-releases/2010/pr10165.html|July 23, 2010|$139.3|$134.3|First Citizens Bank and Trust Company, Inc., Columbia, SC has agreed to assume all deposits, excluding certain brokered deposits.
Crescent Bank and Trust Company, Jasper, GA|https://www.fdic.gov/resources/resolutions/bank-failures/failed-bank-list/crescentga.html|||PR-164-2010|https://www.fdic.gov/news/press-releases/2010/pr10164.html|July 23, 2010|$1,010.0|$965.7|The Renasant Bank, Tupelo, MS has agreed to assume all deposits, excluding certain brokered deposits.
Sterling Bank, Lantana, FL|https://www.fdic.gov/resources/resolutions/bank-failures/failed-bank-list/sterlingfl.html|||PR-163-2010|https://www.fdic.gov/news/press-releases/2010/pr10163.html|July 23, 2010|$407.9|$372.4|IBERIABANK, Lafayette, LA has agreed to assume all deposits, excluding certain brokered deposits.
Mainstreet Savings Bank, FSB, Hastings, MI|https://www.fdic.gov/resources/resolutions/bank-failures/failed-bank-list/mainstsvgs.html|||PR-159-2010|https://www.fdic.gov/news/press-releases/2010/pr10159.html|July 16, 2010|$97.4|$63.7|Commercial Bank, Alma, MI has agreed to assume all deposits.
Olde Cypress Community Bank, Clewiston, FL|https://www.fdic.gov/resources/resolutions/bank-failures/failed-bank-list/oldecypress.html|||PR-158-2010|https://www.fdic.gov/news/press-releases/2010/pr10158.html|July 16, 2010|$168.7|$162.4|CenterState Bank of Florida, National Association, Winter Haven, FL has agreed to assume all deposits, excluding certain brokered deposits.
Turnberry Bank, Aventura, FL|https://www.fdic.gov/resources/resolutions/bank-failures/failed-bank-list/turnberry.html|||PR-157-2010|https://www.fdic.gov/news/press-releases/2010/pr10157.html|July 16, 2010|$263.9|$196.9|NAFH National Bank, Miami, FL has agreed to assume all deposits.
Metro Bank of Dade County, Miami, FL|https://www.fdic.gov/resources/resolutions/bank-failures/failed-bank-list/metrobankfl.html|||PR-157-2010|https://www.fdic.gov/news/press-releases/2010/pr10157.html|July 16, 2010|$442.3|$391.3|NAFH National Bank, Miami, FL has agreed to assume all deposits, excluding certain brokered deposits.
First National Bank of the South, Spartanburg, SC|https://www.fdic.gov/resources/resolutions/bank-failures/failed-bank-list/firstnatlsc.html|||PR-157-2010|https://www.fdic.gov/news/press-releases/2010/pr10157.html|July 16, 2010|$682.0|$610.1|NAFH National Bank, Miami, FL has agreed to assume all deposits, excluding certain brokered deposits.
Woodlands Bank, Bluffton, SC|https://www.fdic.gov/resources/resolutions/bank-failures/failed-bank-list/woodlands.html|||PR-156-2010|https://www.fdic.gov/news/press-releases/2010/pr10156.html|July 16, 2010|$376.2|$355.3|Bank of the Ozarks, Little Rock, AR has agreed to assume all deposits, excluding certain brokered deposits.
Home National Bank, Blackwell, OK|https://www.fdic.gov/resources/resolutions/bank-failures/failed-bank-list/homenatlok.html|||PR-152-2010|https://www.fdic.gov/news/press-releases/2010/pr10152.html|July 9, 2010|$644.5|$560.7|RCB Bank, Claremore, OK has agreed to assume all deposits.
USA Bank, Port Chester, NY|https://www.fdic.gov/resources/resolutions/bank-failures/failed-bank-list/usabankny.html|||PR-151-2010|https://www.fdic.gov/news/press-releases/2010/pr10151.html|July 9, 2010|$193.3|$189.9|The FDIC entered into a purchase and assumption agreement with New Century Bank (doing business as Customers 1st Bank), Phoenixville, PA, to assume all of the deposits of USA Bank.
Ideal Federal Savings Bank, Baltimore, MD|https://www.fdic.gov/resources/resolutions/bank-failures/failed-bank-list/idealfedsvngsmd.html|||PR-150-2010|https://www.fdic.gov/news/press-releases/2010/pr10150.html|July 9, 2010|$6.3|$5.8|The FDIC has approved the payout of the insured deposits of Ideal Federal Savings Bank.
Bay National Bank, Baltimore, MD|https://www.fdic.gov/resources/resolutions/bank-failures/failed-bank-list/baynatlmd.html|||PR-149-2010|https://www.fdic.gov/news/press-releases/2010/pr10149.html|July 9, 2010|$282.2|$276.1|To protect the depositors, the FDIC entered into a purchase and assumption agreement with Bay Bank, FSB, Lutherville, MD, to assume all of the deposits of Bay National Bank.
High Desert State Bank, Albuquerque, NM|https://www.fdic.gov/resources/resolutions/bank-failures/failed-bank-list/highdesertnm.html|||PR-145-2010|https://www.fdic.gov/news/press-releases/2010/pr10145.html|June 25, 2010|$80.3|$81.0|First American Bank, Artesia, NM, has agreed to assume all deposits.
First National Bank, Savannah, GA|https://www.fdic.gov/resources/resolutions/bank-failures/failed-bank-list/firstnatga.html|||PR-144-2010|https://www.fdic.gov/news/press-releases/2010/pr10144.html|June 25, 2010|$252.5|$231.9|The Savannah Bank, National Association, Savannah, GA has agreed to assume all deposits, excluding certain brokered deposits.
Peninsula Bank, Englewood, FL|https://www.fdic.gov/resources/resolutions/bank-failures/failed-bank-list/peninsulafl.html|||PR-143-2010|https://www.fdic.gov/news/press-releases/2010/pr10143.html|June 25, 2010|$644.3|$580.1|Premier American Bank, Miami, FL has agreed to assume all deposits excluding certain brokered deposits.
Nevada Security Bank, Reno, NV|https://www.fdic.gov/resources/resolutions/bank-failures/failed-bank-list/nevsecbank.html|||PR-137-2010|https://www.fdic.gov/news/press-releases/2010/pr10137.html|June 18, 2010|$480.3|$479.8|Umpqua Bank, Roseburg, OR has agreed to assume all deposits, excluding certain brokered deposits.
Washington First International Bank, Seattle, WA|https://www.fdic.gov/resources/resolutions/bank-failures/failed-bank-list/washfirstintl.html|||PR-133-2010|https://www.fdic.gov/news/press-releases/2010/pr10133.html|June 11, 2010|$520.9|$441.4|East West Bank, Pasadena, CA has agreed to assume all deposits.
TierOne Bank, Lincoln, NE|https://www.fdic.gov/resources/resolutions/bank-failures/failed-bank-list/tieronebankne.html|||PR-132-2010|https://www.fdic.gov/news/press-releases/2010/pr10132.html|June 4, 2010|$2,800.0|$2,200.0|Great Western Bank, Sioux Falls, SD has agreed to assume all deposits.
Arcola Homestead Savings Bank, Arcola, IL|https://www.fdic.gov/resources/resolutions/bank-failures/failed-bank-list/arcolail.html|||PR-131-2010|https://www.fdic.gov/news/press-releases/2010/pr10131.html|June 4, 2010|$17.0|$18.1|The FDIC has approved the payout of the insured deposits of Arcola Homestead Savings Bank.
First National Bank, Rosedale, MS|https://www.fdic.gov/resources/resolutions/bank-failures/failed-bank-list/firstnatms.html|||PR-130-2010|https://www.fdic.gov/news/press-releases/2010/pr10130.html|June 4, 2010|$60.4|$63.5|Jefferson Bank, Fayette, MS has agreed to assume all deposits.
Sun West Bank, Las Vegas, NV|https://www.fdic.gov/resources/resolutions/bank-failures/failed-bank-list/swbnevada.html|||PR-127-2010|https://www.fdic.gov/news/press-releases/2010/pr10127.html|May 28, 2010|$360.7|$353.9|City National Bank, Los Angeles, CA has agreed to assume all deposits, excluding certain brokered deposits.
Granite Community Bank, NA, Granite Bay, CA|https://www.fdic.gov/resources/resolutions/bank-failures/failed-bank-list/graniteca.html|||PR-126-2010|https://www.fdic.gov/news/press-releases/2010/pr10126.html|May 28, 2010|$102.9|$94.2|Tri Counties Bank, Chico, CA has agreed to assume all deposits.
Bank of Florida - Tampa Bay, Tampa, FL|https://www.fdic.gov/resources/resolutions/bank-failures/failed-bank-list/bankoffloridatb.html|||PR-125-2010|https://www.fdic.gov/news/press-releases/2010/pr10125.html|May 28, 2010|$245.2|$224.0|EverBank, Jacksonville, FL has agreed to assume all deposits, excluding certain brokered deposits.
Bank of Florida - Southwest, Naples, FL|https://www.fdic.gov/resources/resolutions/bank-failures/failed-bank-list/bankoffloridasw.html|||PR-125-2010|https://www.fdic.gov/news/press-releases/2010/pr10125.html|May 28, 2010|$640.9|$559.9|EverBank, Jacksonville, FL has agreed to assume all deposits, excluding certain brokered deposits.
Bank of Florida - Southeast, Fort Lauderdale, FL|https://www.fdic.gov/resources/resolutions/bank-failures/failed-bank-list/bankoffloridase.html|||PR-125-2010|https://www.fdic.gov/news/press-releases/2010/pr10125.html|May 28, 2010|$595.3|$531.7|EverBank, Jacksonville, FL has agreed to assume all deposits, excluding certain brokered deposits.
Pinehurst Bank, St. Paul, MN|https://www.fdic.gov/resources/resolutions/bank-failures/failed-bank-list/pinehurstmn.html|||PR-118-2010|https://www.fdic.gov/news/press-releases/2010/pr10118.html|May 21, 2010|$61.2|$58.3|Coulee Bank, La Crosse, WI has agreed to assume all deposits.
Midwest Bank and Trust Company, Elmwood Park, IL|https://www.fdic.gov/resources/resolutions/bank-failures/failed-bank-list/midwestil.html|||PR-116-2010|https://www.fdic.gov/news/press-releases/2010/pr10116.html|May 14, 2010|$3,170.0|$2,420.0|FirstMerit Bank, National Association, Akron, OH has agreed to assume all deposits.
Southwest Community Bank, Springfield, MO|https://www.fdic.gov/resources/resolutions/bank-failures/failed-bank-list/swcmntymo.html|||PR-115-2010|https://www.fdic.gov/news/press-releases/2010/pr10115.html|May 14, 2010|$96.6|$102.5|Simmons First National Bank, Pine Bluff, AR has agreed to assume all deposits.
New Liberty Bank, Plymouth, MI|https://www.fdic.gov/resources/resolutions/bank-failures/failed-bank-list/newlibertymi.html|||PR-114-2010|https://www.fdic.gov/news/press-releases/2010/pr10114.html|May 14, 2010|$109.1|$101.8|Bank of Ann Arbor, Ann Arbor, MI has agreed to assume all deposits, excluding certain brokered deposits.
Satilla Community Bank, Saint Marys, GA|https://www.fdic.gov/resources/resolutions/bank-failures/failed-bank-list/satillacmntyga.html|||PR-113-2010|https://www.fdic.gov/news/press-releases/2010/pr10113.html|May 14, 2010|$135.7|$134.0|Ameris Bank, Moulterie, GA has agreed to assume all deposits, excluding certain brokered deposits.
1st Pacific Bank of California, San Diego, CA|https://www.fdic.gov/resources/resolutions/bank-failures/failed-bank-list/1stpacific.html|||PR-109-2010|https://www.fdic.gov/news/press-releases/2010/pr10109.html|May 7, 2010|$335.8|$291.2|City National Bank, Los Angeles, CA has agreed to assume all deposits, excluding certain brokered deposits.
Towne Bank of Arizona, Mesa, AZ|https://www.fdic.gov/resources/resolutions/bank-failures/failed-bank-list/townebank.html|||PR-108-2010|https://www.fdic.gov/news/press-releases/2010/pr10108.html|May 7, 2010|$120.2|$113.2|Commerce Bank of Arizona, Mesa, AZ has agreed to assume all deposits, excluding certain brokered deposits.
Access Bank, Champlin, MN|https://www.fdic.gov/resources/resolutions/bank-failures/failed-bank-list/accessbank.html|||PR-107-2010|https://www.fdic.gov/news/press-releases/2010/pr10107.html|May 7, 2010|$32.0|$32.0|PrinsBank, Prinsburg, MN has agreed to assume all deposits.
The Bank of Bonifay, Bonifay, FL|https://www.fdic.gov/resources/resolutions/bank-failures/failed-bank-list/bonifay.html|||PR-106-2010|https://www.fdic.gov/news/press-releases/2010/pr10106.html|May 7, 2010|$242.9|$230.2|First Federal Bank of Florida, Lake City, FL has agreed to assume all deposits.
Frontier Bank, Everett, WA|https://www.fdic.gov/resources/resolutions/bank-failures/failed-bank-list/frontier.html|||PR-101-2010|https://www.fdic.gov/news/press-releases/2010/pr10101.html|April 30, 2010|$3,500.0|$3,130.0|Union Bank, National Association, San Francisco, CA has agreed to assume all deposits, excluding certain brokered deposits.
BC National Banks, Butler, MO|https://www.fdic.gov/resources/resolutions/bank-failures/failed-bank-list/bc-natl.html|||PR-100-2010|https://www.fdic.gov/news/press-releases/2010/pr10100.html|April 30, 2010|$67.2|$54.9|Community First Bank, Butler, MO has agreed to assume all deposits.
Champion Bank, Creve Coeur, MO|https://www.fdic.gov/resources/resolutions/bank-failures/failed-bank-list/champion.html|||PR-099-2010|https://www.fdic.gov/news/press-releases/2010/pr10099.html|April 30, 2010|$187.3|$153.8|BankLiberty, Liberty, PR has agreed to assume all deposits, excluding certain brokered deposits.
CF Bancorp, Port Huron, MI|https://www.fdic.gov/resources/resolutions/bank-failures/failed-bank-list/cfbancorp.html|||PR-098-2010|https://www.fdic.gov/news/press-releases/2010/pr10098.html|April 30, 2010|$1,650.0|$1,430.0|First Michigan Bank, Troy, MI has agreed to assume all deposits, excluding certain brokered deposits.
Westernbank Puerto Rico, Mayaguez, PR|https://www.fdic.gov/resources/resolutions/bank-failures/failed-bank-list/westernbank-puertorico.html|||PR-097-2010|https://www.fdic.gov/news/press-releases/2010/pr10097.html|April 30, 2010|$11,940.0|$8,620.0|Banco Popular de Puerto Rico, San Juan, PR has agreed to assume all deposits, excluding certain brokered deposits.
R-G Premier Bank of Puerto Rico, Hato Rey, PR|https://www.fdic.gov/resources/resolutions/bank-failures/failed-bank-list/r-gpremier-puertorico.html|||PR-096-2010|https://www.fdic.gov/news/press-releases/2010/pr10096.html|April 30, 2010|$5,920.0|$4,250.0|Scotiabank de Puerto Rico, San Juan, PR has agreed to assume all deposits, excluding certain brokered deposits.
Eurobank, San Juan, PR|https://www.fdic.gov/resources/resolutions/bank-failures/failed-bank-list/eurobank-puertorico.html|||PR-095-2010|https://www.fdic.gov/news/press-releases/2010/pr10095.html|April 30, 2010|$2,560.0|$1,970.0|Oriental Bank and Trust, San Juan, PR has agreed to assume all deposits, excluding certain brokered deposits.
Wheatland Bank, Naperville, IL|https://www.fdic.gov/resources/resolutions/bank-failures/failed-bank-list/wheatland.html|||PR-090-2010|https://www.fdic.gov/news/press-releases/2010/pr10090.html|April 23, 2010|$437.2|$438.5|Wheaton Bank & Trust, Wheaton, IL has agreed to assume all deposits, excluding certain brokered deposits.
Peotone Bank and Trust Company, Peotone, IL|https://www.fdic.gov/resources/resolutions/bank-failures/failed-bank-list/peotone.html|||PR-089-2010|https://www.fdic.gov/news/press-releases/2010/pr10089.html|April 23, 2010|$130.2|$127.0|First Midwest Bank, Itasca, IL has agreed to assume all deposits, excluding certain brokered deposits.
Lincoln Park Savings Bank, Chicago, IL|https://www.fdic.gov/resources/resolutions/bank-failures/failed-bank-list/lincoln-park.html|||PR-088-2010|https://www.fdic.gov/news/press-releases/2010/pr10088.html|April 23, 2010|$199.9|$171.5|Northbrook Bank and Trust Company, Northbrook, IL has agreed to assume all deposits.
New Century Bank, Chicago, IL|https://www.fdic.gov/resources/resolutions/bank-failures/failed-bank-list/new-century-il.html|||PR-087-2010|https://www.fdic.gov/news/press-releases/2010/pr10087.html|April 23, 2010|$485.6|$492.0|MB Financial Bank, National Association, Chicago, IL has agreed to assume all deposits.
Citizens Bank & Trust Company of Chicago, Chicago, IL|https://www.fdic.gov/resources/resolutions/bank-failures/failed-bank-list/citizens-bank.html|||PR-086-2010|https://www.fdic.gov/news/press-releases/2010/pr10086.html|April 23, 2010|$77.3|$74.5|Republic Bank of Chicago, Oak Brook, IL has agreed to assume all deposits.
Broadway Bank, Chicago, IL|https://www.fdic.gov/resources/resolutions/bank-failures/failed-bank-list/broadway.html|||PR-085-2010|https://www.fdic.gov/news/press-releases/2010/pr10085.html|April 23, 2010|$1,200.0|$1,100.0|MB Financial Bank, National Association, Chicago, IL has agreed to assume all deposits, excluding certain brokered deposits.
Amcore Bank, National Association, Rockford, IL|https://www.fdic.gov/resources/resolutions/bank-failures/failed-bank-list/amcore.html|||PR-084-2010|https://www.fdic.gov/news/press-releases/2010/pr10084.html|April 23, 2010|$3,800.0|$3,400.0|Harris National Association, Chicago, IL has agreed to assume all deposits, excluding certain brokered deposits.
City Bank, Lynnwood, WA|https://www.fdic.gov/resources/resolutions/bank-failures/failed-bank-list/citybank.html|||PR-082-2010|https://www.fdic.gov/news/press-releases/2010/pr10082.html|April 16, 2010|$1,130.0|$1,020.0|Whidbey Island Bank, Coupeville, WA has agreed to assume all deposits, excluding certain brokered deposits.
Tamalpais Bank, San Rafael, CA|https://www.fdic.gov/resources/resolutions/bank-failures/failed-bank-list/tamalpais.html|||PR-081-2010|https://www.fdic.gov/news/press-releases/2010/pr10081.html|April 16, 2010|$628.9|$487.6|Union Bank, National Association, San Francisco, CA has agreed to assume all deposits, excluding certain brokered deposits.
Innovative Bank, Oakland, CA|https://www.fdic.gov/resources/resolutions/bank-failures/failed-bank-list/innovative.html|||PR-080-2010|https://www.fdic.gov/news/press-releases/2010/pr10080.html|April 16, 2010|$268.9|$225.2|Center Bank, Los Angeles, CA has agreed to assume all deposits, excluding certain brokered deposits.
Butler Bank, Lowell, MA|https://www.fdic.gov/resources/resolutions/bank-failures/failed-bank-list/butlerbank.html|||PR-079-2010|https://www.fdic.gov/news/press-releases/2010/pr10079.html|April 16, 2010|$268.0|$233.2|People's United Bank, Bridgeport, CT has agreed to assume all deposits.
Riverside National Bank of Florida, Fort Pierce, FL|https://www.fdic.gov/resources/resolutions/bank-failures/failed-bank-list/riverside-natl.html|||PR-078-2010|https://www.fdic.gov/news/press-releases/2010/pr10078.html|April 16, 2010|$3,420.0|$2,760.0|TD Bank, National Association, Wilmington, DE has agreed to assume all deposits, excluding certain brokered deposits.
AmericanFirst Bank, Clermont, FL|https://www.fdic.gov/resources/resolutions/bank-failures/failed-bank-list/americanfirst.html|||PR-078-2010|https://www.fdic.gov/news/press-releases/2010/pr10078.html|April 16, 2010|$90.5|$81.9|TD Bank, National Association, Wilmington, DE has agreed to assume all deposits, excluding certain brokered deposits.
First Federal Bank of North Florida, Palatka, FL|https://www.fdic.gov/resources/resolutions/bank-failures/failed-bank-list/ffbnf.html|||PR-078-2010|https://www.fdic.gov/news/press-releases/2010/pr10078.html|April 16, 2010|$393.3|$324.2|TD Bank, National Association, Wilmington, DE has agreed to assume all deposits.
Lakeside Community Bank, Sterling Heights, MI|https://www.fdic.gov/resources/resolutions/bank-failures/failed-bank-list/lakeside-comm.html|||PR-077-2010|https://www.fdic.gov/news/press-releases/2010/pr10077.html|April 16, 2010|$53.0|$52.3|The FDIC has approved the payout of the insured deposits of Lakeside Community Bank.
Beach First National Bank, Myrtle Beach, SC|https://www.fdic.gov/resources/resolutions/bank-failures/failed-bank-list/beachfirst.html|||PR-073-2010|https://www.fdic.gov/news/press-releases/2010/pr10073.html|April 9, 2010|$585.1|$516.0|Bank of North Carolina, Thomasville, NC has agreed to assume all deposits, excluding certain brokered deposits.
Desert Hills Bank, Phoenix, AZ|https://www.fdic.gov/resources/resolutions/bank-failures/failed-bank-list/deserthills.html|||PR-069-2010|https://www.fdic.gov/news/press-releases/2010/pr10069.html|March 26, 2010|$496.6|$426.5|New York Community Bank, Westbury, NY has agreed to assume all deposits, excluding certain brokered deposits.
Unity National Bank, Cartersville, GA|https://www.fdic.gov/resources/resolutions/bank-failures/failed-bank-list/unity-natl.html|||PR-068-2010|https://www.fdic.gov/news/press-releases/2010/pr10068.html|March 26, 2010|$292.2|$264.3|Bank of the Ozarks, Little Rock, AR has agreed to assume all deposits, excluding certain brokered deposits.
Key West Bank, Key West, FL|https://www.fdic.gov/resources/resolutions/bank-failures/failed-bank-list/key-west.html|||PR-067-2010|https://www.fdic.gov/news/press-releases/2010/pr10067.html|March 26, 2010|$88.0|$67.7|Centennial Bank, Conway, AR has agreed to assume all deposits, excluding certain brokered deposits.
McIntosh Commercial Bank, Carrollton, GA|https://www.fdic.gov/resources/resolutions/bank-failures/failed-bank-list/mcintosh.html|||PR-066-2010|https://www.fdic.gov/news/press-releases/2010/pr10066.html|March 26, 2010|$362.9|$343.3|CharterBank, West Point, GA has agreed to assume all deposits, excluding certain brokered deposits.
State Bank of Aurora, Aurora, MN|https://www.fdic.gov/resources/resolutions/bank-failures/failed-bank-list/state-aurora.html|||PR-062-2010|https://www.fdic.gov/news/press-releases/2010/pr10062.html|March 19, 2010|$28.2|$27.8|Northern State Bank, Ashland, WI has agreed to assume all deposits.
First Lowndes Bank, Fort Deposit, AL|https://www.fdic.gov/resources/resolutions/bank-failures/failed-bank-list/firstlowndes.html|||PR-061-2010|https://www.fdic.gov/news/press-releases/2010/pr10061.html|March 19, 2010|$137.2|$131.1|First Citizens Bank, Luverne, AL has agreed to assume all deposits.
Bank of Hiawassee, Hiawassee, GA|https://www.fdic.gov/resources/resolutions/bank-failures/failed-bank-list/bankofhiawassee.html|||PR-060-2010|https://www.fdic.gov/news/press-releases/2010/pr10060.html|March 19, 2010|$377.8|$339.6|Citizens South Bank, Gastonia, NC has agreed to assume all deposits, excluding certain brokered deposits.
Appalachian Community Bank, Ellijay, GA|https://www.fdic.gov/resources/resolutions/bank-failures/failed-bank-list/appalachian.html|||PR-059-2010|https://www.fdic.gov/news/press-releases/2010/pr10059.html|March 19, 2010|$1,010.0|$917.6|Community & Southern Bank, Carrollton, GA has agreed to assume all deposits.
Advanta Bank Corp., Draper, UT|https://www.fdic.gov/resources/resolutions/bank-failures/failed-bank-list/advanta-ut.html|||PR-058-2010|https://www.fdic.gov/news/press-releases/2010/pr10058.html|March 19, 2010|$1,600.0|$1,500.0|The FDIC has approved the payout of the insured deposits of Advanta Bank Corp.
Century Security Bank, Duluth, GA|https://www.fdic.gov/resources/resolutions/bank-failures/failed-bank-list/cent-security.html|||PR-057-2010|https://www.fdic.gov/news/press-releases/2010/pr10057.html|March 19, 2010|$96.5|$94.0|Bank of Upson, Thomaston, GA has agreed to assume all deposits, excluding certain brokered deposits.
