bank_name|bank_link|city|state|pr_id|pr_link|closing_date|assets|deposit|acquirer_notes
American National Bank, Parma, OH|https://www.fdic.gov/resources/resolutions/bank-failures/failed-bank-list/amer-natl-oh.html|||PR-056-2010|https://www.fdic.gov/news/press-releases/2010/pr10056.html|March 19, 2010|$70.3|$66.8|The National Bank and Trust Company, Wilmington, OH has agreed to assume all deposits, excluding certain brokered deposits.
Statewide Bank, Covington, LA|https://www.fdic.gov/resources/resolutions/bank-failures/failed-bank-list/statewide.html|||PR-053-2010|https://www.fdic.gov/news/press-releases/2010/pr10053.html|March 12, 2010|$243.2|$208.8|Home Bank, Lafayette, LA has agreed to assume all deposits.
Old Southern Bank, Orlando, FL|https://www.fdic.gov/resources/resolutions/bank-failures/failed-bank-list/oldsouthern.html|||PR-052-2010|https://www.fdic.gov/news/press-releases/2010/pr10052.html|March 12, 2010|$315.6|$319.7|Centennial Bank, Conway, AR has agreed to assume all deposits.
Park Avenue Bank, New York, NY|https://www.fdic.gov/resources/resolutions/bank-failures/failed-bank-list/parkavenue-ny.html|||PR-051-2010|https://www.fdic.gov/news/press-releases/2010/pr10051.html|March 12, 2010|$520.1|$494.5|Valley National Bank, Wayne, NJ has agreed to assume all deposits, excluding certain brokered deposits.
LibertyPointe Bank, New York, NY|https://www.fdic.gov/resources/resolutions/bank-failures/failed-bank-list/libertypointe.html|||PR-049-2010|https://www.fdic.gov/news/press-releases/2010/pr10049.html|March 11, 2010|$209.7|$209.5|Valley National Bank, Wayne, NJ has agreed to assume all deposits.
Centennial Bank, Ogden, UT|https://www.fdic.gov/resources/resolutions/bank-failures/failed-bank-list/centennial-ut.html|||PR-046-2010|https://www.fdic.gov/news/press-releases/2010/pr10046.html|March 5, 2010|$215.2|$205.1|The FDIC has approved the payout of the insured deposits of Centennial Bank.
Waterfield Bank, Germantown, MD|https://www.fdic.gov/resources/resolutions/bank-failures/failed-bank-list/waterfield.html|||PR-045-2010|https://www.fdic.gov/news/press-releases/2010/pr10045.html|March 5, 2010|$155.6|$156.4|To protect the insured depositors, the FDIC created Waterfield Bank, FA - a new depository institution chartered by the Office of Thrift Supervision (OTS) and insured by the FDIC - to take over the operations of Waterfield Bank. The FDIC will mail checks directly to customers with CDs and IRAs for the amount of their insured funds.
Bank of Illinois, Normal, IL|https://www.fdic.gov/resources/resolutions/bank-failures/failed-bank-list/bankofillinois.html|||PR-044-2010|https://www.fdic.gov/news/press-releases/2010/pr10044.html|March 5, 2010|$211.7|$198.5|Heartland Bank and Trust Company, Bloomington, IL has agreed to assume all deposits, excluding certain brokered deposits.
Sun American Bank, Boca Raton, FL|https://www.fdic.gov/resources/resolutions/bank-failures/failed-bank-list/sunamerican.html|||PR-043-2010|https://www.fdic.gov/news/press-releases/2010/pr10043.html|March 5, 2010|$535.7|$443.5|First-Citizens Bank & Trust Company, Raleigh, NC has agreed to assume all deposits, excluding certain brokered deposits.
Rainier Pacific Bank, Tacoma, WA|https://www.fdic.gov/resources/resolutions/bank-failures/failed-bank-list/rainier.html|||PR-041-2010|https://www.fdic.gov/news/press-releases/2010/pr10041.html|February 26, 2010|$717.8|$446.2|Umpqua Bank, Roseburg, OR has agreed to assume all deposits, excluding certain brokered deposits.
Carson River Community Bank, Carson City, NV|https://www.fdic.gov/resources/resolutions/bank-failures/failed-bank-list/carsonriver.html|||PR-040-2010|https://www.fdic.gov/news/press-releases/2010/pr10040.html|February 26, 2010|$51.1|$50.0|Heritage Bank of Nevada, Reno, NV has agreed to assume all deposits, excluding certain brokered deposits.
La Jolla Bank, FSB, La Jolla, CA|https://www.fdic.gov/resources/resolutions/bank-failures/failed-bank-list/lajolla.html|||PR-034-2010|https://www.fdic.gov/news/press-releases/2010/pr10034.html|February 19, 2010|$3,600.0|$2,800.0|OneWest Bank, FSB, Pasadena, CA has agreed to assume all deposits.
George Washington Savings Bank, Orland Park, IL|https://www.fdic.gov/resources/resolutions/bank-failures/failed-bank-list/georgewashington.html|||PR-033-2010|https://www.fdic.gov/news/press-releases/2010/pr10033.html|February 19, 2010|$412.8|$395.3|FirstMerit Bank, National Association, Akron, OH has agreed to assume all deposits.
The La Coste National Bank, La Coste, TX|https://www.fdic.gov/resources/resolutions/bank-failures/failed-bank-list/lacoste.html|||PR-032-2010|https://www.fdic.gov/news/press-releases/2010/pr10032.html|February 19, 2010|$53.9|$49.3|Community National Bank, Hondo, TX has agreed to assume all deposits.
Marco Community Bank, Marco Island, FL|https://www.fdic.gov/resources/resolutions/bank-failures/failed-bank-list/marco.html|||PR-031-2010|https://www.fdic.gov/news/press-releases/2010/pr10031.html|February 19, 2010|$119.6|$117.1|Mutual of Omaha Bank, Omaha, NE has agreed to assume all deposits, excluding certain brokered deposits.
1st American State Bank of Minnesota, Hancock, MN|https://www.fdic.gov/resources/resolutions/bank-failures/failed-bank-list/1stamerican.html|||PR-030-2010|https://www.fdic.gov/news/press-releases/2010/pr10030.html|February 5, 2010|$18.2|$16.3|Community Development Bank, FSB, Ogema, MN has agreed to assume all deposits.
American Marine Bank, Bainbridge Island, WA|https://www.fdic.gov/resources/resolutions/bank-failures/failed-bank-list/americanmarine.html|||PR-027-2010|https://www.fdic.gov/news/press-releases/2010/pr10027.html|January 29, 2010|$373.2|$308.5|Columbia State Bank, Tacoma, WA has agreed to assume all deposits, excluding certain brokered deposits.
First Regional Bank, Los Angeles, CA|https://www.fdic.gov/resources/resolutions/bank-failures/failed-bank-list/firstregional.html|||PR-026-2010|https://www.fdic.gov/news/press-releases/2010/pr10026.html|January 29, 2010|$2,180.0|$1,870.0|First-Citizens Bank & Trust Company, Raleigh, NC has agreed to assume all deposits, excluding certain brokered deposits.
Community Bank and Trust, Cornelia, GA|https://www.fdic.gov/resources/resolutions/bank-failures/failed-bank-list/cbt-cornelia.html|||PR-025-2010|https://www.fdic.gov/news/press-releases/2010/pr10025.html|January 29, 2010|$1,210.0|$1,110.0|SCBT National Association, Orangeburg, SC has agreed to assume all deposits, excluding certain brokered deposits.
Marshall Bank, National Association, Hallock, MN|https://www.fdic.gov/resources/resolutions/bank-failures/failed-bank-list/marshall-mn.html|||PR-024-2010|https://www.fdic.gov/news/press-releases/2010/pr10024.html|January 29, 2010|$59.9|$54.7|United Valley Bank, Cavalier, ND has agreed to assume all deposits.
Florida Community Bank, Immokalee, FL|https://www.fdic.gov/resources/resolutions/bank-failures/failed-bank-list/floridacommunity.html|||PR-023-2010|https://www.fdic.gov/news/press-releases/2010/pr10023.html|January 29, 2010|$875.5|$795.5|Premier American Bank, National Association, Miami, FL has agreed to assume all deposits, excluding certain brokered deposits.
First National Bank of Georgia, Carrollton, GA|https://www.fdic.gov/resources/resolutions/bank-failures/failed-bank-list/firstnational-carrollton.html|||PR-022-2010|https://www.fdic.gov/news/press-releases/2010/pr10022.html|January 29, 2010|$832.6|$757.9|Community and Southern Bank, Carrollton, GA has agreed to assume all deposits, excluding certain brokered deposits.
Columbia River Bank, The Dalles, OR|https://www.fdic.gov/resources/resolutions/bank-failures/failed-bank-list/columbiariver.html|||PR-018-2010|https://www.fdic.gov/news/press-releases/2010/pr10018.html|January 22, 2010|$1,100.0|$1,000.0|Columbia State Bank, Tacoma, WA has agreed to assume all deposits.
Evergreen Bank, Seattle, WA|https://www.fdic.gov/resources/resolutions/bank-failures/failed-bank-list/evergreen-wa.html|||PR-017-2010|https://www.fdic.gov/news/press-releases/2010/pr10017.html|January 22, 2010|$488.5|$439.4|Umpqua Bank, Roseburg, OR has agreed to assume all deposits, excluding certain brokered deposits.
Charter Bank, Santa Fe, NM|https://www.fdic.gov/resources/resolutions/bank-failures/failed-bank-list/charter-nm.html|||PR-016-2010|https://www.fdic.gov/news/press-releases/2010/pr10016.html|January 22, 2010|$1,200.0|$851.5|Charter Bank, Albuquerque, NM has agreed to assume all deposits, excluding certain brokered deposits.
Bank of Leeton, Leeton, MO|https://www.fdic.gov/resources/resolutions/bank-failures/failed-bank-list/leeton.html|||PR-015-2010|https://www.fdic.gov/news/press-releases/2010/pr10015.html|January 22, 2010|$20.1|$20.4|Sunflower Bank, National Association, Salina, KS has agreed to assume all deposits.
Premier American Bank, Miami, FL|https://www.fdic.gov/resources/resolutions/bank-failures/failed-bank-list/premieramerican.html|||PR-014-2010|https://www.fdic.gov/news/press-releases/2010/pr10014.html|January 22, 2010|$350.9|$326.3|Premier American Bank, National Association, Miami, FL has agreed to assume all deposits, excluding certain brokered deposits.
Barnes Banking Company, Kaysville, UT|https://www.fdic.gov/resources/resolutions/bank-failures/failed-bank-list/barnes.html|||PR-010-2010|https://www.fdic.gov/news/press-releases/2010/pr10010.html|January 15, 2010|$827.8|$786.5|"The FDIC has created the Deposit Insurance National Bank of Kaysville, UT (""DINB of Kaysville"") to facilitate the resolution of Barnes Banking Company, Kaysville, UT."
St. Stephen State Bank, St. Stephen, MN|https://www.fdic.gov/resources/resolutions/bank-failures/failed-bank-list/ststephen.html|||PR-009-2010|https://www.fdic.gov/news/press-releases/2010/pr10009.html|January 15, 2010|$24.7|$23.4|First State Bank of St. Joseph, St. Joseph, MN has agreed to assume all deposits.
Town Community Bank and Trust, Antioch, IL|https://www.fdic.gov/resources/resolutions/bank-failures/failed-bank-list/towncommunity.html|||PR-008-2010|https://www.fdic.gov/news/press-releases/2010/pr10008.html|January 15, 2010|$69.6|$67.4|First American Bank, Elk Grove Village, IL has agreed to assume all deposits, excluding certain brokered deposits.
Horizon Bank, Bellingham, WA|https://www.fdic.gov/resources/resolutions/bank-failures/failed-bank-list/horizon-wa.html|||PR-004-2010|https://www.fdic.gov/news/press-releases/2010/pr10004.html|January 8, 2010|$1,300.0|$1,100.0|Washington Federal Savings and Loan Association, Seattle, WA has agreed to assume all deposits, excluding certain brokered deposits.
Western National Bank, Phoenix, AZ|https://www.fdic.gov/resources/resolutions/bank-failures/failed-bank-list/westernnatl.html|||PR-195-2011|https://www.fdic.gov/news/press-releases/2011/pr11195.html|December 16, 2011|$162.9|$144.5|Washington Federal, Seattle, WA has agreed to assume all deposits excluding certain brokered deposits.
Premier Community Bank of the Emerald Coast, Crestview, FL|https://www.fdic.gov/resources/resolutions/bank-failures/failed-bank-list/premier-fl.html|||PR-194-2011|https://www.fdic.gov/news/press-releases/2011/pr11194.html|December 16, 2011|$126.0|$112.1|Summit Bank, National Association, Panama City, FL has agreed to assume all deposits.
Central Progressive Bank, Lacombe, LA|https://www.fdic.gov/resources/resolutions/bank-failures/failed-bank-list/centralprog.html|||PR-181-2011|https://www.fdic.gov/news/press-releases/2011/pr11181.html|November 18, 2011|$383.1|$347.7|First NBC Bank, New Orleans, LA has agreed to assume all deposits.
Polk County Bank, Johnston, IA|https://www.fdic.gov/resources/resolutions/bank-failures/failed-bank-list/polkcounty.html|||PR-180-2011|https://www.fdic.gov/news/press-releases/2011/pr11180.html|November 18, 2011|$91.6|$82.0|Grinnell State Bank, Grinnell, IA has agreed to assume all deposits.
Community Bank of Rockmart, Rockmart, GA|https://www.fdic.gov/resources/resolutions/bank-failures/failed-bank-list/rockmart.html|||PR-178-2011|https://www.fdic.gov/news/press-releases/2011/pr11178.html|November 10, 2011|$62.4|$55.9|Century Bank of Georgia, Cartersville, GA has agreed to assume all deposits excluding certain brokered deposits.
SunFirst Bank, Saint George, UT|https://www.fdic.gov/resources/resolutions/bank-failures/failed-bank-list/sunfirst.html|||PR-177-2011|https://www.fdic.gov/news/press-releases/2011/pr11177.html|November 4, 2011|$198.1|$169.1|Cache Valley Bank, Logan, UT has agreed to assume all deposits excluding certain brokered deposits.
Mid City Bank, Inc., Omaha, NE|https://www.fdic.gov/resources/resolutions/bank-failures/failed-bank-list/midcity.html|||PR-176-2011|https://www.fdic.gov/news/press-releases/2011/pr11176.html|November 4, 2011|$106.1|$105.5|Premier Bank (formerly Purdum State Bank), Purdum, NE has agreed to assume all deposits.
All American Bank, Des Plaines, IL|https://www.fdic.gov/resources/resolutions/bank-failures/failed-bank-list/allamerican.html|||PR-174-2011|https://www.fdic.gov/news/press-releases/2011/pr11174.html|October 28, 2011|$37.8|$33.4|International Bank of Chicago, Chicago, IL has agreed to assume all deposits.
Community Banks of Colorado, Greenwood Village, CO|https://www.fdic.gov/resources/resolutions/bank-failures/failed-bank-list/commbanksco.html|||PR-172-2011|https://www.fdic.gov/news/press-releases/2011/pr11172.html|October 21, 2011|$1,380.0|$1,330.0|Bank Midwest, National Association, Kansas City, MO has agreed to assume all deposits excluding certain brokered deposits.
Community Capital Bank, Jonesboro, GA|https://www.fdic.gov/resources/resolutions/bank-failures/failed-bank-list/commcapbk.html|||PR-171-2011|https://www.fdic.gov/news/press-releases/2011/pr11171.html|October 21, 2011|$181.2|$166.2|State Bank and Trust Company, Macon, GA has agreed to assume all deposits.
Decatur First Bank, Decatur, GA|https://www.fdic.gov/resources/resolutions/bank-failures/failed-bank-list/decatur.html|||PR-170-2011|https://www.fdic.gov/news/press-releases/2011/pr11170.html|October 21, 2011|$191.5|$179.2|Fidelity Bank, Atlanta, GA has agreed to assume all deposits.
Old Harbor Bank, Clearwater, FL|https://www.fdic.gov/resources/resolutions/bank-failures/failed-bank-list/oldharbor.html|||PR-169-2011|https://www.fdic.gov/news/press-releases/2011/pr11169.html|October 21, 2011|$215.9|$217.8|1st United Bank, Boca Raton, FL has agreed to assume all deposits.
Country Bank, Aledo, IL|https://www.fdic.gov/resources/resolutions/bank-failures/failed-bank-list/countrybank.html|||PR-167-2011|https://www.fdic.gov/news/press-releases/2011/pr11167.html|October 14, 2011|$190.6|$167.5|Blackhawk Bank & Trust, Milan, IL has agreed to assume all deposits excluding certain brokered deposits.
First State Bank, Cranford, NJ|https://www.fdic.gov/resources/resolutions/bank-failures/failed-bank-list/firststatebank-nj.html|||PR-166-2011|https://www.fdic.gov/news/press-releases/2011/pr11166.html|October 14, 2011|$204.4|$201.2|Northfield Bank, Staten Island, NY has agreed to assume all deposits.
Blue Ridge Savings Bank, Inc., Asheville, NC|https://www.fdic.gov/resources/resolutions/bank-failures/failed-bank-list/blueridge.html|||PR-165-2011|https://www.fdic.gov/news/press-releases/2011/pr11165.html|October 14, 2011|$161.0|$158.7|Bank of North Carolina, Thomasville, NC has agreed to assume all deposits.
Piedmont Community Bank, Gray, GA|https://www.fdic.gov/resources/resolutions/bank-failures/failed-bank-list/piedmont-ga.html|||PR-164-2011|https://www.fdic.gov/news/press-releases/2011/pr11164.html|October 14, 2011|$201.7|$181.4|State Bank and Trust Company, Macon, GA has agreed to assume all deposits.
Sun Security Bank, Ellington, MO|https://www.fdic.gov/resources/resolutions/bank-failures/failed-bank-list/sunsecurity.html|||PR-159-2011|https://www.fdic.gov/news/press-releases/2011/pr11159.html|October 7, 2011|$355.9|$290.4|Great Southern Bank, Springfield, MO has agreed to assume all deposits.
The RiverBank, Wyoming, MN|https://www.fdic.gov/resources/resolutions/bank-failures/failed-bank-list/riverbank.html|||PR-158-2011|https://www.fdic.gov/news/press-releases/2011/pr11158.html|October 7, 2011|$417.4|$379.3|Central Bank, Stillwater, MN has agreed to assume all deposits.
First International Bank, Plano, TX|https://www.fdic.gov/resources/resolutions/bank-failures/failed-bank-list/firstintlbank.html|||PR-156-2011|https://www.fdic.gov/news/press-releases/2011/pr11156.html|September 30, 2011|$239.9|$208.8|American First National Bank, Houston, TX has agreed to assume all deposits.
Citizens Bank of Northern California, Nevada City, CA|https://www.fdic.gov/resources/resolutions/bank-failures/failed-bank-list/cbnc.html|||PR-154-2011|https://www.fdic.gov/news/press-releases/2011/pr11154.html|September 23, 2011|$288.8|$253.1|Tri Counties Bank, Chico, CA has agreed to assume all deposits.
Bank of the Commonwealth, Norfolk, VA|https://www.fdic.gov/resources/resolutions/bank-failures/failed-bank-list/boc-va.html|||PR-153-2011|https://www.fdic.gov/news/press-releases/2011/pr11153.html|September 23, 2011|$985.1|$901.8|Southern Bank and Trust Company, Mount Olive, NC has agreed to assume all deposits excluding certain brokered deposits.
The First National Bank Of Florida, Milton, FL|https://www.fdic.gov/resources/resolutions/bank-failures/failed-bank-list/fnbf.html|||PR-149-2011|https://www.fdic.gov/news/press-releases/2011/pr11149.html|September 9, 2011|$296.8|$280.1|CharterBank, West Point, GA has agreed to assume all deposits.
CreekSide Bank, Woodstock, GA|https://www.fdic.gov/resources/resolutions/bank-failures/failed-bank-list/creekside.html|||PR-146-2011|https://www.fdic.gov/news/press-releases/2011/pr11146.html|September 2, 2011|$102.3|$96.6|Georgia Commerce Bank, Atlanta, GA has agreed to assume all deposits.
Patriot Bank of Georgia, Cumming, GA|https://www.fdic.gov/resources/resolutions/bank-failures/failed-bank-list/patriot.html|||PR-146-2011|https://www.fdic.gov/news/press-releases/2011/pr11146.html|September 2, 2011|$150.8|$111.2|Georgia Commerce Bank, Atlanta, GA has agreed to assume all deposits.
First Choice Bank, Geneva, IL|https://www.fdic.gov/resources/resolutions/bank-failures/failed-bank-list/firstchoice-il.html|||PR-139-2011|https://www.fdic.gov/news/press-releases/2011/pr11139.html|August 19, 2011|$141.0|$137.2|Inland Bank & Trust, Oak Brook, IL has agreed to assume all deposits excluding certain brokered deposits.
First Southern National Bank, Statesboro, GA|https://www.fdic.gov/resources/resolutions/bank-failures/failed-bank-list/firstsouthern-ga.html|||PR-138-2011|https://www.fdic.gov/news/press-releases/2011/pr11138.html|August 19, 2011|$164.6|$159.7|Heritage Bank of the South, Albany, GA has agreed to assume all deposits excluding certain brokered deposits.
Lydian Private Bank, Palm Beach, FL|https://www.fdic.gov/resources/resolutions/bank-failures/failed-bank-list/lydian.html|||PR-137-2011|https://www.fdic.gov/news/press-releases/2011/pr11137.html|August 19, 2011|$1,700.0|$1,240.0|Sabadell United Bank, National Association, Miami, FL has agreed to assume all deposits.
Public Savings Bank, Huntingdon Valley, PA|https://www.fdic.gov/resources/resolutions/bank-failures/failed-bank-list/publicsvgs.html|||PR-136-2011|https://www.fdic.gov/news/press-releases/2011/pr11136.html|August 18, 2011|$46.8|$45.8|Capital Bank, National Association, Rockville, MD has agreed to assume all deposits excluding certain brokered deposits.
The First National Bank of Olathe, Olathe, KS|https://www.fdic.gov/resources/resolutions/bank-failures/failed-bank-list/fnbo.html|||PR-134-2011|https://www.fdic.gov/news/press-releases/2011/pr11134.html|August 12, 2011|$538.1|$524.3|Enterprise Bank & Trust, Clayton, MO has agreed to assume all deposits excluding certain brokered deposits.
Bank of Whitman, Colfax, WA|https://www.fdic.gov/resources/resolutions/bank-failures/failed-bank-list/whitman.html|||PR-132-2011|https://www.fdic.gov/news/press-releases/2011/pr11132.html|August 5, 2011|$548.6|$515.7|Columbia State Bank, Tacoma, WA has agreed to assume all deposits excluding certain brokered deposits.
Bank of Shorewood, Shorewood, IL|https://www.fdic.gov/resources/resolutions/bank-failures/failed-bank-list/shorewood.html|||PR-131-2011|https://www.fdic.gov/news/press-releases/2011/pr11131.html|August 5, 2011|$110.7|$104.0|Heartland Bank and Trust Company, Bloomington, IL has agreed to assume all deposits.
Integra Bank National Association, Evansville, IN|https://www.fdic.gov/resources/resolutions/bank-failures/failed-bank-list/integra.html|||PR-128-2011|https://www.fdic.gov/news/press-releases/2011/pr11128.html|July 29, 2011|$2,200.0|$1,900.0|Old National Bank, Evansville, IN has agreed to assume all deposits excluding certain brokered deposits.
BankMeridian, National Association, Columbia, SC|https://www.fdic.gov/resources/resolutions/bank-failures/failed-bank-list/bankmeridian.html|||PR-127-2011|https://www.fdic.gov/news/press-releases/2011/pr11127.html|July 29, 2011|$239.8|$215.5|SCBT, National Association, Orangeburg, SC has agreed to assume all deposits excluding certain brokered deposits.
Virginia Business Bank, Richmond, VA|https://www.fdic.gov/resources/resolutions/bank-failures/failed-bank-list/vbb.html|||PR-126-2011|https://www.fdic.gov/news/press-releases/2011/pr11126.html|July 29, 2011|$95.8|$85.0|Xenith Bank, Richmond, VA has agreed to assume all deposits.
Bank of Choice, Greeley, CO|https://www.fdic.gov/resources/resolutions/bank-failures/failed-bank-list/bankofchoice.html|||PR-124-2011|https://www.fdic.gov/news/press-releases/2011/pr11124.html|July 22, 2011|$1,070.0|$924.9|Bank Midwest, National Association, Kansas City, MO has agreed to assume all deposits excluding certain brokered deposits.
LandMark Bank of Florida, Sarasota, FL|https://www.fdic.gov/resources/resolutions/bank-failures/failed-bank-list/LandMark.html|||PR-123-2011|https://www.fdic.gov/news/press-releases/2011/pr11123.html|July 22, 2011|$275.0|$246.7|American Momentum Bank, Tampa, FL has agreed to assume all deposits.
Southshore Community Bank, Apollo Beach, FL|https://www.fdic.gov/resources/resolutions/bank-failures/failed-bank-list/southshore.html|||PR-123-2011|https://www.fdic.gov/news/press-releases/2011/pr11123.html|July 22, 2011|$46.3|$45.3|American Momentum Bank, Tampa, FL has agreed to assume all deposits.
Summit Bank, Prescott, AZ|https://www.fdic.gov/resources/resolutions/bank-failures/failed-bank-list/summitbank.html|||PR-122-2011|https://www.fdic.gov/news/press-releases/2011/pr11122.html|July 15, 2011|$72.0|$66.4|The Foothills Bank, Yuma, AZ has agreed to assume all deposits.
First Peoples Bank, Port St. Lucie, FL|https://www.fdic.gov/resources/resolutions/bank-failures/failed-bank-list/firstpeoples.html|||PR-121-2011|https://www.fdic.gov/news/press-releases/2011/pr11121.html|July 15, 2011|$228.3|$209.7|Premier American Bank, National Association, Miami, FL has agreed to assume all deposits excluding certain brokered deposits.
High Trust Bank, Stockbridge, GA|https://www.fdic.gov/resources/resolutions/bank-failures/failed-bank-list/hightrust.html|||PR-120-2011|https://www.fdic.gov/news/press-releases/2011/pr11120.html|July 15, 2011|$192.5|$189.5|Ameris Bank, Moultrie, GA has agreed to assume all deposits.
One Georgia Bank, Atlanta, GA|https://www.fdic.gov/resources/resolutions/bank-failures/failed-bank-list/onegeorgia.html|||PR-120-2011|https://www.fdic.gov/news/press-releases/2011/pr11120.html|July 15, 2011|$186.3|$162.1|Ameris Bank, Moultrie, GA has agreed to assume all deposits excluding certain brokered deposits.
Signature Bank, Windsor, CO|https://www.fdic.gov/resources/resolutions/bank-failures/failed-bank-list/signaturebank.html|||PR-119-2011|https://www.fdic.gov/news/press-releases/2011/pr11119.html|July 8, 2011|$66.7|$64.5|Points West Community Bank, Julesburg, CO has agreed to assume all deposits.
Colorado Capital Bank, Castle Rock, CO|https://www.fdic.gov/resources/resolutions/bank-failures/failed-bank-list/coloradocapital.html|||PR-118-2011|https://www.fdic.gov/news/press-releases/2011/pr11118.html|July 8, 2011|$717.5|$672.8|First-Citizens Bank & Trust Company, Raleigh, NC has agreed to assume all deposits excluding certain brokered deposits.
First Chicago Bank & Trust, Chicago, IL|https://www.fdic.gov/resources/resolutions/bank-failures/failed-bank-list/firstchicago.html|||PR-117-2011|https://www.fdic.gov/news/press-releases/2011/pr11117.html|July 8, 2011|$959.3|$887.5|Northbrook Bank & Trust Company, Northbrook, IL has agreed to assume all deposits excluding certain brokered deposits.
Mountain Heritage Bank, Clayton, GA|https://www.fdic.gov/resources/resolutions/bank-failures/failed-bank-list/mountain.html|||PR-110-2011|https://www.fdic.gov/news/press-releases/2011/pr11110.html|June 24, 2011|$103.7|$89.6|First American Bank and Trust Company, Athens, GA has agreed to assume all deposits excluding certain brokered deposits.
First Commercial Bank of Tampa Bay, Tampa, FL|https://www.fdic.gov/resources/resolutions/bank-failures/failed-bank-list/fcbtb.html|||PR-105-2011|https://www.fdic.gov/news/press-releases/2011/pr11105.html|June 17, 2011|$98.6|$92.6|Stonegate Bank, Fort Lauderdale, FL has agreed to assume all deposits excluding certain brokered deposits.
McIntosh State Bank, Jackson, GA|https://www.fdic.gov/resources/resolutions/bank-failures/failed-bank-list/mcintoshstate.html|||PR-104-2011|https://www.fdic.gov/news/press-releases/2011/pr11104.html|June 17, 2011|$339.9|$324.4|Hamilton State Bank, Hoschton, GA has agreed to assume all deposits.
Atlantic Bank and Trust, Charleston, SC|https://www.fdic.gov/resources/resolutions/bank-failures/failed-bank-list/atlanticbanktrust.html|||PR-100-2011|https://www.fdic.gov/news/press-releases/2011/pr11100.html|June 3, 2011|$208.2|$191.6|First Citizens Bank and Trust Company, Inc., Columbia, SC has agreed to assume all deposits.
